<?xml version="1.0" encoding="utf-8" ?>
<mapping xsi:noNamespaceSchemaLocation="..\Mapping.xsd"
         xmlns:xsi="http://www.w3.org/2001/XMLSchema-instance">
  <entry from='&#x00A1;' to='ā' />
  <entry from='&#x00A2;' to='ī' order='-1' />
  <entry from='&#x00A3;' to='ū' />
  <entry from='&#x00A4;' to='ṛ' />
  <entry from='&#x00A5;' to='ṝ' />
  <entry from='&#x00A7;' to='ṙ' />
  <entry from='&#x00AB;' to='ḻ' />
  <entry from='&#x00AC;' to='ḻ̄' />
  <entry from='&#x00AE;' to='ē' />
  <entry from='&#x00B0;' to='ō' />
  <entry from='&#x00B4;' to='ṅ' />
  <entry from='&#x00B5;' to='ñ' />
  <entry from='&#x00B6;' to='ṭ' />
  <entry from='&#x00B7;' to='ḍ' />
  <entry from='&#x00B8;' to='ṇ' />
  <entry from='&#x00BA;' to='ṉ' />
  <entry from='&#x00BB;' to='ẏ' />
  <entry from='&#x00BC;' to='ṟ' />
  <entry from='&#x00BD;' to='ḷ' />
  <entry from='&#x00BE;' to='ẕ' />
  <entry from='&#x00BF;' to='ś' />
  <entry from='&#x00C0;' to='ṣ' />
  <entry from='&#x00C4;' to='m̐' />
  <entry from='&#x00C5;' to='ḥ' />
  <entry from='&#x00C6;' to='ṃ' />
  <entry from='&#x00C7;' to='ḹ' />
  <entry from='&#x00C8;' to='ḏ' />
  <entry from='&#x00C9;' to='ṯ' />
  <entry from='&#x00CB;' to='Ā' />
  <entry from='&#x00CC;' to='Ī' />
  <entry from='&#x00CD;' to='Ū' />
  <entry from='&#x00CE;' to='Ṛ' />
  <entry from='&#x00CF;' to='Ṝ' />
  <entry from='&#x00D0;' to='Ṙ' />
  <entry from='&#x00D1;' to='Ḻ' order='-1' />
  <entry from='&#x00D2;' to='Ḻ̄' />
  <entry from='&#x00D3;' to='Ē' />
  <entry from='&#x00D5;' to='Ō' />
  <entry from='&#x00D7;' to='Ṅ' />
  <entry from='&#x00D8;' to='Ñ' />
  <entry from='&#x00D9;' to='Ṭ' />
  <entry from='&#x00DA;' to='Ḍ' />
  <entry from='&#x00DB;' to='Ṇ' />
  <entry from='&#x00DC;' to='Ṉ' />
  <entry from='&#x00DD;' to='Ẏ' />
  <entry from='&#x00DE;' to='Ṟ' />
  <entry from='&#x00DF;' to='Ḷ' />
  <entry from='&#x00E0;' to='Ẕ' />
  <entry from='&#x00E1;' to='Ś' />
  <entry from='&#x00E2;' to='Ṣ' />
  <entry from='&#x00E8;' to='M̐' />
  <entry from='&#x00E9;' to='Ḥ' />
  <entry from='&#x00EA;' to='Ṃ' />
  <entry from='&#x00EB;' to='Ḹ' />
  <entry from='&#x00EC;' to='Ḏ' />
  <entry from='&#x00ED;' to='Ṯ' />
  <entry from='&#x00EE;' to='ī' />
  <entry from='&#x00EF;' to='Ị' />
  <entry from='&#x00F0;' to='Ị̄' />
</mapping>
