<?xml version="1.0" encoding="UTF-8"?>
<mapping xsi:noNamespaceSchemaLocation="..\Mapping.xsd"
         xmlns:xsi="http://www.w3.org/2001/XMLSchema-instance">
  <entry from="&amp;" to="–" />
  <entry from="&#xB5;" to="—" />
  <entry from="&#x03BC;" to="—" />
  <entry from="]" to="," />
  <entry from="_" to=";" />
  <entry from="\" to="?" />
  <entry from="-" to="." />
  <entry from="A" to="।" comment="danda" />
  <entry from="&#xFB;" to="॥" comment="double danda" />
  <entry from="^" to="‘" />
  <entry from="*" to="’" />
  <entry from="&#xDF;" to="“" />
  <entry from="&#xDE;" to="”" />
  <entry from="&#xFD;" to="[" />
  <entry from="@" to="/" />
  <entry from="&#x17E;" to="&lt;" />
  <entry from="&#xF1;" to="॰" />
  <entry from="$" to="+" />
  <entry from="&#xBB;" to="÷" />
  <entry from="&#xBE;" to="=" />
  <entry from="&#x178;" to="&gt;" />
  <entry from="&#xFE;" to="]" order="2" />
</mapping>
