<?xml version="1.0" encoding="utf-8" ?>
<mapping xsi:noNamespaceSchemaLocation="..\Mapping.xsd"
         xmlns:xsi="http://www.w3.org/2001/XMLSchema-instance">
  <entry from='&#x00B5;' to='⚬' />
  <entry from='&#x00B7;' to='[lotus]' order='1000' />
  <entry from='&#x00BE;' to='[tilak]' order='1000' />
  <entry from='&#x00C0;' to='Ṁ' />
  <entry from='&#x00C1;' to='ē̃' order='3' />
  <entry from='&#x00C2;' to='ō̃' order='3' />
  <entry from='&#x00C3;' to='ā̃' order='-1' />
  <entry from='&#x00C4;' to='Ā' />
  <entry from='&#x00C5;' to='Ṛ' />
  <entry from='&#x00C7;' to='Ś' />
  <entry from='&#x00C8;' to='Ṝ' order='3' />
  <entry from='&#x00C9;' to='Ī' />
  <entry from='&#x00CB;' to='Ṇ' />
  <entry from='&#x00CC;' to='Ṅ' />
  <entry from='&#x00CD;' to='ī̃' order='3' />
  <entry from='&#x00CE;' to='Ã' />
  <entry from='&#x00CF;' to='Ñ' />
  <entry from='&#x00D1;' to='Ṣ' order='-1' />
  <entry from='&#x00D2;' to='Ḍ' />
  <entry from='&#x00D3;' to='ū̃' order='3' />
  <entry from='&#x00D6;' to='Ṭ' />
  <entry from='&#x00D7;' to='ẽ' />
  <entry from='&#x00D8;' to='ī̃' order='-1' />
  <entry from='&#x00D9;' to='Ḥ' />
  <entry from='&#x00DB;' to='´' />
  <entry from='&#x00DC;' to='Ū' />
  <entry from='&#x00DE;' to='Ḷ' />
  <entry from='&#x00E0;' to='ṁ' />
  <entry from='&#x00E1;' to='ē' />
  <entry from='&#x00E2;' to='ō' />
  <entry from='&#x00E4;' to='ā' />
  <entry from='&#x00E5;' to='ṛ' />
  <entry from='&#x00E7;' to='ś' />
  <entry from='&#x00E8;' to='ṝ' order='3' />
  <entry from='&#x00E9;' to='ī' />
  <entry from='&#x00EA;' to='ṙ' />
  <entry from='&#x00EB;' to='ṇ' />
  <entry from='&#x00EC;' to='ṅ' />
  <entry from='&#x00ED;' to='ĩ' />
  <entry from='&#x00EE;' to='ɔ' />
  <entry from='&#x00EF;' to='ñ' />
  <entry from='&#x00F1;' to='ṣ' order='-1' />
  <entry from='&#x00F2;' to='ḍ' />
  <entry from='&#x00F3;' to='ũ' />
  <entry from='&#x00F6;' to='ṭ' />
  <entry from='&#x00F7;' to='→' />
  <entry from='&#x00F8;' to='ī' order='-1' />
  <entry from='&#x00F9;' to='ḥ' />
  <entry from='&#x00FB;' to='&#x0301;' />
  <entry from='&#x00FC;' to='ū' />
  <entry from='&#x00FE;' to='l̐' />
  <entry from='&#x00FF;' to='ḷ' />
  <entry from='&#x0152;' to='◡' />
  <entry from='&#x03BC;' to='⚬' />
  <entry from='&#x2219;' to='[lotus]' order='999' />
  <entry from='&#xF101;' to='^' />
  <entry from='&#xF102;' to=' &#x0303;' />
  <entry from='&#xF103;' to='&#x0131;' />
  <entry from='&#xF104;' to='˙' />
</mapping>
